Question	Parse
tracking_grants_for_research: for each staff id, what is the description of the role that is involved with the most number of projects? | document_types : document_type_code , document_description | documents : document_id , document_type_code , grant_id , sent_date , response_received_date , other_details | grants : grant_id , organisation_id , grant_amount , grant_start_date , grant_end_date , other_details | organisation_types : organisation_type , organisation_type_description | organisations : organisation_id , organisation_type , organisation_details | project_outcomes : project_id , outcome_code , outcome_details | project_staff : staff_id , project_id , role_code , date_from , date_to , other_details | projects : project_id , organisation_id , project_details | research_outcomes : outcome_code , outcome_description | research_staff : staff_id , employer_organisation_id , staff_details | staff_roles : role_code , role_description | tasks : task_id , project_id , task_details , eg agree objectives	select t1.role_description , t2.staff_id from staff_roles as t1 join project_staff as t2 on t1.role_code = t2.role_code join project_outcomes as t3 on t2.project_id = t3.project_id group by t2.staff_id order by count(*) desc limit 1
tracking_grants_for_research: what is the id of the organization with the maximum number of outcomes and how many outcomes are there? | document_types : document_type_code , document_description | documents : document_id , document_type_code , grant_id , sent_date , response_received_date , other_details | grants : grant_id , organisation_id , grant_amount , grant_start_date , grant_end_date , other_details | organisation_types : organisation_type , organisation_type_description | organisations : organisation_id , organisation_type , organisation_details | project_outcomes : project_id , outcome_code , outcome_details | project_staff : staff_id , project_id , role_code , date_from , date_to , other_details | projects : project_id , organisation_id , project_details | research_outcomes : outcome_code , outcome_description | research_staff : staff_id , employer_organisation_id , staff_details | staff_roles : role_code , role_description | tasks : task_id , project_id , task_details , eg agree objectives	select t1.organisation_id , count(*) from projects as t1 join project_outcomes as t2 on t1.project_id = t2.project_id group by t1.organisation_id order by count(*) desc limit 1
college_3: which building does the instructor who teaches the most number of courses live in? | student : stuid , lname , fname , age , sex , major , advisor , city_code | faculty : facid , lname , fname , rank , sex , phone , room , building | department : dno , division , dname , room , building , dphone | member_of : facid , dno , appt_type | course : cid , cname , credits , instructor , days , hours , dno | minor_in : stuid , dno | enrolled_in : stuid , cid , grade | gradeconversion : lettergrade , gradepoint	select t2.building from course as t1 join faculty as t2 on t1.instructor = t2.facid group by t1.instructor order by count(*) desc limit 1
college_3: give the building that the instructor who teaches the greatest number of courses lives in. | student : stuid , lname , fname , age , sex , major , advisor , city_code | faculty : facid , lname , fname , rank , sex , phone , room , building | department : dno , division , dname , room , building , dphone | member_of : facid , dno , appt_type | course : cid , cname , credits , instructor , days , hours , dno | minor_in : stuid , dno | enrolled_in : stuid , cid , grade | gradeconversion : lettergrade , gradepoint	select t2.building from course as t1 join faculty as t2 on t1.instructor = t2.facid group by t1.instructor order by count(*) desc limit 1
department_store: what are the name, phone number and email address of the customer who made the largest number of orders? | addresses : address_id , address_details | staff : staff_id , staff_gender , staff_name | suppliers : supplier_id , supplier_name , supplier_phone | department_store_chain : dept_store_chain_id , dept_store_chain_name | customers : customer_id , payment_method_code , customer_code , customer_name , customer_address , customer_phone , customer_email | products : product_id , product_type_code , product_name , product_price | supplier_addresses : supplier_id , address_id , date_from , date_to | customer_addresses : customer_id , address_id , date_from , date_to | customer_orders : order_id , customer_id , order_status_code , order_date | department_stores : dept_store_id , dept_store_chain_id , store_name , store_address , store_phone , store_email | departments : department_id , dept_store_id , department_name | order_items : order_item_id , order_id , product_id | product_suppliers : product_id , supplier_id , date_supplied_from , date_supplied_to , total_amount_purchased , total_value_purchased | staff_department_assignments : staff_id , department_id , date_assigned_from , job_title_code , date_assigned_to	select t1.customer_name , t1.customer_phone , t1.customer_email from customers as t1 join customer_orders as t2 on t1.customer_id = t2.customer_id group by t2.customer_id order by count(*) desc limit 1
department_store: return the average total amount purchased and total value purchased for the supplier who supplies the greatest number of products. | addresses : address_id , address_details | staff : staff_id , staff_gender , staff_name | suppliers : supplier_id , supplier_name , supplier_phone | department_store_chain : dept_store_chain_id , dept_store_chain_name | customers : customer_id , payment_method_code , customer_code , customer_name , customer_address , customer_phone , customer_email | products : product_id , product_type_code , product_name , product_price | supplier_addresses : supplier_id , address_id , date_from , date_to | customer_addresses : customer_id , address_id , date_from , date_to | customer_orders : order_id , customer_id , order_status_code , order_date | department_stores : dept_store_id , dept_store_chain_id , store_name , store_address , store_phone , store_email | departments : department_id , dept_store_id , department_name | order_items : order_item_id , order_id , product_id | product_suppliers : product_id , supplier_id , date_supplied_from , date_supplied_to , total_amount_purchased , total_value_purchased | staff_department_assignments : staff_id , department_id , date_assigned_from , job_title_code , date_assigned_to	select avg(total_amount_purchased) , avg(total_value_purchased) from product_suppliers where supplier_id = (select supplier_id from product_suppliers group by supplier_id order by count(*) desc limit 1)
music_2: what is the last name of the musician that have produced the most number of songs? | songs : songid , title | albums : aid , title , year , label , type | band : id , firstname , lastname | instruments : songid , bandmateid , instrument | performance : songid , bandmate , stageposition | tracklists : albumid , position , songid | vocals : songid , bandmate , type	select t2.lastname from performance as t1 join band as t2 on t1.bandmate = t2.id join songs as t3 on t3.songid = t1.songid group by lastname order by count(*) desc limit 1
voter_2: find the major that is studied by the largest number of students. | student : stuid , lname , fname , age , sex , major , advisor , city_code | voting_record : stuid , registration_date , election_cycle , president_vote , vice_president_vote , secretary_vote , treasurer_vote , class_president_vote , class_senator_vote	select major from student group by major order by count(*) desc limit 1
products_gen_characteristics: what is the characteristic name used by most number of the products? | ref_characteristic_types : characteristic_type_code , characteristic_type_description | ref_colors : color_code , color_description | ref_product_categories : product_category_code , product_category_description , unit_of_measure | characteristics : characteristic_id , characteristic_type_code , characteristic_data_type , characteristic_name , other_characteristic_details | products : product_id , color_code , product_category_code , product_name , typical_buying_price , typical_selling_price , product_description , other_product_details | product_characteristics : product_id , characteristic_id , product_characteristic_value	select t3.characteristic_name from products as t1 join product_characteristics as t2 on t1.product_id = t2.product_id join characteristics as t3 on t2.characteristic_id = t3.characteristic_id group by t3.characteristic_name order by count(*) desc limit 1
dorm_1: find the first name of students who are living in the dorm that has most number of amenities. | student : stuid , lname , fname , age , sex , major , advisor , city_code | dorm : dormid , dorm_name , student_capacity , gender | dorm_amenity : amenid , amenity_name | has_amenity : dormid , amenid | lives_in : stuid , dormid , room_number	select t1.fname from student as t1 join lives_in as t2 on t1.stuid = t2.stuid where t2.dormid in (select t2.dormid from dorm as t3 join has_amenity as t4 on t3.dormid = t4.dormid join dorm_amenity as t5 on t4.amenid = t5.amenid group by t3.dormid order by count(*) desc limit 1)
game_1: which game type has most number of games? | student : stuid , lname , fname , age , sex , major , advisor , city_code | video_games : gameid , gname , gtype | plays_games : stuid , gameid , hours_played | sportsinfo : stuid , sportname , hoursperweek , gamesplayed , onscholarship	select gtype from video_games group by gtype order by count(*) desc limit 1
game_1: what is the first name and last name of the student who have most number of sports? | student : stuid , lname , fname , age , sex , major , advisor , city_code | video_games : gameid , gname , gtype | plays_games : stuid , gameid , hours_played | sportsinfo : stuid , sportname , hoursperweek , gamesplayed , onscholarship	select t2.fname , t2.lname from sportsinfo as t1 join student as t2 on t1.stuid = t2.stuid group by t1.stuid order by count(*) desc limit 1
game_1: which sport has most number of students on scholarship? | student : stuid , lname , fname , age , sex , major , advisor , city_code | video_games : gameid , gname , gtype | plays_games : stuid , gameid , hours_played | sportsinfo : stuid , sportname , hoursperweek , gamesplayed , onscholarship	select sportname from sportsinfo where onscholarship = 'y' group by sportname order by count(*) desc limit 1
game_1: show the game name that has most number of hours played. | student : stuid , lname , fname , age , sex , major , advisor , city_code | video_games : gameid , gname , gtype | plays_games : stuid , gameid , hours_played | sportsinfo : stuid , sportname , hoursperweek , gamesplayed , onscholarship	select gname from plays_games as t1 join video_games as t2 on t1.gameid = t2.gameid group by t1.gameid order by sum(hours_played) desc limit 1
customers_and_addresses: which product has been ordered most number of times? | addresses : address_id , address_content , city , zip_postcode , state_province_county , country , other_address_details | products : product_id , product_details | customers : customer_id , payment_method , customer_name , date_became_customer , other_customer_details | customer_addresses : customer_id , address_id , date_address_from , address_type , date_address_to | customer_contact_channels : customer_id , channel_code , active_from_date , active_to_date , contact_number | customer_orders : order_id , customer_id , order_status , order_date , order_details | order_items : order_id , product_id , order_quantity	select t2.product_details from order_items as t1 join products as t2 on t1.product_id = t2.product_id group by t1.product_id order by count(*) desc limit 1
cre_docs_and_epenses: show the statement id and the statement detail for the statement with most number of accounts. | ref_document_types : document_type_code , document_type_name , document_type_description | ref_budget_codes : budget_type_code , budget_type_description | projects : project_id , project_details | documents : document_id , document_type_code , project_id , document_date , document_name , document_description , other_details | statements : statement_id , statement_details | documents_with_expenses : document_id , budget_type_code , document_details | accounts : account_id , statement_id , account_details	select t1.statement_id , t2.statement_details from accounts as t1 join statements as t2 on t1.statement_id = t2.statement_id group by t1.statement_id order by count(*) desc limit 1
cre_docs_and_epenses: what is the document type code with most number of documents? | ref_document_types : document_type_code , document_type_name , document_type_description | ref_budget_codes : budget_type_code , budget_type_description | projects : project_id , project_details | documents : document_id , document_type_code , project_id , document_date , document_name , document_description , other_details | statements : statement_id , statement_details | documents_with_expenses : document_id , budget_type_code , document_details | accounts : account_id , statement_id , account_details	select document_type_code from documents group by document_type_code order by count(*) desc limit 1
cre_docs_and_epenses: what is the budget type code with most number of documents. | ref_document_types : document_type_code , document_type_name , document_type_description | ref_budget_codes : budget_type_code , budget_type_description | projects : project_id , project_details | documents : document_id , document_type_code , project_id , document_date , document_name , document_description , other_details | statements : statement_id , statement_details | documents_with_expenses : document_id , budget_type_code , document_details | accounts : account_id , statement_id , account_details	select budget_type_code from documents_with_expenses group by budget_type_code order by count(*) desc limit 1
wine_1: what is the area of the appelation that produces the highest number of wines before the year of 2010? | grapes : id , grape , color | appellations : no , appelation , county , state , area , isava | wine : no , grape , winery , appelation , state , name , year , price , score , cases , drink	select t1.area from appellations as t1 join wine as t2 on t1.appelation = t2.appelation group by t2.appelation having t2.year < 2010 order by count(*) desc limit 1
wine_1: find the county where produces the most number of wines with score higher than 90. | grapes : id , grape , color | appellations : no , appelation , county , state , area , isava | wine : no , grape , winery , appelation , state , name , year , price , score , cases , drink	select t1.county from appellations as t1 join wine as t2 on t1.appelation = t2.appelation where t2.score > 90 group by t1.county order by count(*) desc limit 1
driving_school: which city does has most number of customers? | addresses : address_id , line_1_number_building , city , zip_postcode , state_province_county , country | staff : staff_id , staff_address_id , nickname , first_name , middle_name , last_name , date_of_birth , date_joined_staff , date_left_staff | vehicles : vehicle_id , vehicle_details | customers : customer_id , customer_address_id , customer_status_code , date_became_customer , date_of_birth , first_name , last_name , amount_outstanding , email_address , phone_number , cell_mobile_phone_number | customer_payments : customer_id , datetime_payment , payment_method_code , amount_payment | lessons : lesson_id , customer_id , lesson_status_code , staff_id , vehicle_id , lesson_date , lesson_time , price	select t2.city from customers as t1 join addresses as t2 on t1.customer_address_id = t2.address_id group by t2.city order by count(*) desc limit 1;
activity_1: find the building that has the largest number of faculty members. | activity : actid , activity_name | participates_in : stuid , actid | faculty_participates_in : facid , actid | student : stuid , lname , fname , age , sex , major , advisor , city_code | faculty : facid , lname , fname , rank , sex , phone , room , building	select building from faculty group by building order by count(*) desc limit 1
activity_1: find the first and last name of the faculty who is involved in the largest number of activities. | activity : actid , activity_name | participates_in : stuid , actid | faculty_participates_in : facid , actid | student : stuid , lname , fname , age , sex , major , advisor , city_code | faculty : facid , lname , fname , rank , sex , phone , room , building	select t1.fname , t1.lname from faculty as t1 join faculty_participates_in as t2 on t1.facid = t2.facid group by t1.facid order by count(*) desc limit 1
activity_1: find the name of the activity that has the largest number of student participants. | activity : actid , activity_name | participates_in : stuid , actid | faculty_participates_in : facid , actid | student : stuid , lname , fname , age , sex , major , advisor , city_code | faculty : facid , lname , fname , rank , sex , phone , room , building	select t1.activity_name from activity as t1 join participates_in as t2 on t1.actid = t2.actid group by t1.actid order by count(*) desc limit 1
flight_4: find the name and city of the airport which is the destination of the most number of routes. | routes : rid , dst_apid , dst_ap , src_apid , src_ap , alid , airline , codeshare | airports : apid , name , city , country , x , y , elevation , iata , icao | airlines : alid , name , iata , icao , callsign , country , active	select t1.name , t1.city , t2.dst_apid from airports as t1 join routes as t2 on t1.apid = t2.dst_apid group by t2.dst_apid order by count(*) desc limit 1
flight_4: find the names of the top 10 airlines that operate the most number of routes. | routes : rid , dst_apid , dst_ap , src_apid , src_ap , alid , airline , codeshare | airports : apid , name , city , country , x , y , elevation , iata , icao | airlines : alid , name , iata , icao , callsign , country , active	select t1.name , t2.alid from airlines as t1 join routes as t2 on t1.alid = t2.alid group by t2.alid order by count(*) desc limit 10
flight_4: find the name and city of the airport which is the source for the most number of flight routes. | routes : rid , dst_apid , dst_ap , src_apid , src_ap , alid , airline , codeshare | airports : apid , name , city , country , x , y , elevation , iata , icao | airlines : alid , name , iata , icao , callsign , country , active	select t1.name , t1.city , t2.src_apid from airports as t1 join routes as t2 on t1.apid = t2.src_apid group by t2.src_apid order by count(*) desc limit 1
flight_4: which countries has the most number of airlines? | routes : rid , dst_apid , dst_ap , src_apid , src_ap , alid , airline , codeshare | airports : apid , name , city , country , x , y , elevation , iata , icao | airlines : alid , name , iata , icao , callsign , country , active	select country from airlines group by country order by count(*) desc limit 1
flight_4: what is the name of the country with the most number of home airlines? | routes : rid , dst_apid , dst_ap , src_apid , src_ap , alid , airline , codeshare | airports : apid , name , city , country , x , y , elevation , iata , icao | airlines : alid , name , iata , icao , callsign , country , active	select country from airlines group by country order by count(*) desc limit 1
flight_4: which countries has the most number of airlines whose active status is 'y'? | routes : rid , dst_apid , dst_ap , src_apid , src_ap , alid , airline , codeshare | airports : apid , name , city , country , x , y , elevation , iata , icao | airlines : alid , name , iata , icao , callsign , country , active	select country from airlines where active = 'y' group by country order by count(*) desc limit 1
flight_4: find the name of airline which runs the most number of routes. | routes : rid , dst_apid , dst_ap , src_apid , src_ap , alid , airline , codeshare | airports : apid , name , city , country , x , y , elevation , iata , icao | airlines : alid , name , iata , icao , callsign , country , active	select t1.name from airlines as t1 join routes as t2 on t1.alid = t2.alid group by t1.name order by count(*) desc limit 1
flight_4: find the busiest source airport that runs most number of routes in china. | routes : rid , dst_apid , dst_ap , src_apid , src_ap , alid , airline , codeshare | airports : apid , name , city , country , x , y , elevation , iata , icao | airlines : alid , name , iata , icao , callsign , country , active	select t1.name from airports as t1 join routes as t2 on t1.apid = t2.src_apid where t1.country = 'china' group by t1.name order by count(*) desc limit 1
flight_4: what is the name of the airport with the most number of routes that start in china? | routes : rid , dst_apid , dst_ap , src_apid , src_ap , alid , airline , codeshare | airports : apid , name , city , country , x , y , elevation , iata , icao | airlines : alid , name , iata , icao , callsign , country , active	select t1.name from airports as t1 join routes as t2 on t1.apid = t2.src_apid where t1.country = 'china' group by t1.name order by count(*) desc limit 1
flight_4: find the busiest destination airport that runs most number of routes in china. | routes : rid , dst_apid , dst_ap , src_apid , src_ap , alid , airline , codeshare | airports : apid , name , city , country , x , y , elevation , iata , icao | airlines : alid , name , iata , icao , callsign , country , active	select t1.name from airports as t1 join routes as t2 on t1.apid = t2.dst_apid where t1.country = 'china' group by t1.name order by count(*) desc limit 1
flight_4: what is the name of the airport that is the destination of the most number of routes that start in china? | routes : rid , dst_apid , dst_ap , src_apid , src_ap , alid , airline , codeshare | airports : apid , name , city , country , x , y , elevation , iata , icao | airlines : alid , name , iata , icao , callsign , country , active	select t1.name from airports as t1 join routes as t2 on t1.apid = t2.dst_apid where t1.country = 'china' group by t1.name order by count(*) desc limit 1
tracking_orders: what is the name of the customer who has the largest number of orders? | customers : customer_id , customer_name , customer_details | invoices : invoice_number , invoice_date , invoice_details | orders : order_id , customer_id , order_status , date_order_placed , order_details | products : product_id , product_name , product_details | order_items : order_item_id , product_id , order_id , order_item_status , order_item_details | shipments : shipment_id , order_id , invoice_number , shipment_tracking_number , shipment_date , other_shipment_details | shipment_items : shipment_id , order_item_id	select t1.customer_name from customers as t1 join orders as t2 on t1.customer_id = t2.customer_id group by t1.customer_id order by count(*) desc limit 1
