Question	Parse
student_assessment: which course has most number of registered students? | addresses : address_id , line_1 , line_2 , city , zip_postcode , state_province_county , country | people : person_id , first_name , middle_name , last_name , cell_mobile_number , email_address , login_name , password | students : student_id , student_details | courses : course_id , course_name , course_description , other_details | people_addresses : person_address_id , person_id , address_id , date_from , date_to | student_course_registrations : student_id , course_id , registration_date | student_course_attendance : student_id , course_id , date_of_attendance | candidates : candidate_id , candidate_details | candidate_assessments : candidate_id , qualification , assessment_date , asessment_outcome_code	select t1.course_name from courses as t1 join student_course_registrations as t2 on t1.course_id = t2.course_id group by t1.course_id order by count(*) desc limit 1
student_assessment: what is detail of the student who registered the most number of courses? | addresses : address_id , line_1 , line_2 , city , zip_postcode , state_province_county , country | people : person_id , first_name , middle_name , last_name , cell_mobile_number , email_address , login_name , password | students : student_id , student_details | courses : course_id , course_name , course_description , other_details | people_addresses : person_address_id , person_id , address_id , date_from , date_to | student_course_registrations : student_id , course_id , registration_date | student_course_attendance : student_id , course_id , date_of_attendance | candidates : candidate_id , candidate_details | candidate_assessments : candidate_id , qualification , assessment_date , asessment_outcome_code	select t1.student_details from students as t1 join student_course_registrations as t2 on t1.student_id = t2.student_id group by t1.student_id order by count(*) desc limit 1
student_assessment: what are the details of the student who registered for the most number of courses? | addresses : address_id , line_1 , line_2 , city , zip_postcode , state_province_county , country | people : person_id , first_name , middle_name , last_name , cell_mobile_number , email_address , login_name , password | students : student_id , student_details | courses : course_id , course_name , course_description , other_details | people_addresses : person_address_id , person_id , address_id , date_from , date_to | student_course_registrations : student_id , course_id , registration_date | student_course_attendance : student_id , course_id , date_of_attendance | candidates : candidate_id , candidate_details | candidate_assessments : candidate_id , qualification , assessment_date , asessment_outcome_code	select t1.student_details from students as t1 join student_course_registrations as t2 on t1.student_id = t2.student_id group by t1.student_id order by count(*) desc limit 1
flight_1: which origin has most number of flights? | flight : flno , origin , destination , distance , departure_date , arrival_date , price , aid | aircraft : aid , name , distance | employee : eid , name , salary | certificate : eid , aid	select origin from flight group by origin order by count(*) desc limit 1
flight_1: what is the salary and name of the employee who has the most number of aircraft certificates? | flight : flno , origin , destination , distance , departure_date , arrival_date , price , aid | aircraft : aid , name , distance | employee : eid , name , salary | certificate : eid , aid	select t1.name , t1.salary from employee as t1 join certificate as t2 on t1.eid = t2.eid group by t1.eid order by count(*) desc limit 1
flight_1: what is the salary and name of the employee who has the most number of certificates on aircrafts with distance more than 5000? | flight : flno , origin , destination , distance , departure_date , arrival_date , price , aid | aircraft : aid , name , distance | employee : eid , name , salary | certificate : eid , aid	select t1.name from employee as t1 join certificate as t2 on t1.eid = t2.eid join aircraft as t3 on t3.aid = t2.aid where t3.distance > 5000 group by t1.eid order by count(*) desc limit 1
allergy_1: which allergy type has most number of allergies? | allergy_type : allergy , allergytype | has_allergy : stuid , allergy | student : stuid , lname , fname , age , sex , major , advisor , city_code	select allergytype from allergy_type group by allergytype order by count(*) desc limit 1
allergy_1: which major has most number of students? | allergy_type : allergy , allergytype | has_allergy : stuid , allergy | student : stuid , lname , fname , age , sex , major , advisor , city_code	select major from student group by major order by count(*) desc limit 1
allergy_1: which advisor has most number of students? | allergy_type : allergy , allergytype | has_allergy : stuid , allergy | student : stuid , lname , fname , age , sex , major , advisor , city_code	select advisor from student group by advisor order by count(*) desc limit 1
allergy_1: which allergy has most number of students affected? | allergy_type : allergy , allergytype | has_allergy : stuid , allergy | student : stuid , lname , fname , age , sex , major , advisor , city_code	select allergy from has_allergy group by allergy order by count(*) desc limit 1
store_1: find the full name of employee who supported the most number of customers. | artists : id , name | sqlite_sequence : name , seq | albums : id , title , artist_id | employees : id , last_name , first_name , title , reports_to , birth_date , hire_date , address , city , state , country , postal_code , phone , fax , email | customers : id , first_name , last_name , company , address , city , state , country , postal_code , phone , fax , email , support_rep_id | genres : id , name | invoices : id , customer_id , invoice_date , billing_address , billing_city , billing_state , billing_country , billing_postal_code , total | media_types : id , name | tracks : id , name , album_id , media_type_id , genre_id , composer , milliseconds , bytes , unit_price | invoice_lines : id , invoice_id , track_id , unit_price , quantity | playlists : id , name | playlist_tracks : playlist_id , track_id	select t1.first_name , t1.last_name from employees as t1 join customers as t2 on t1.id = t2.support_rep_id group by t1.id order by count(*) desc limit 1
store_1: which employee manage most number of peoples? list employee's first and last name, and number of people report to that employee. | artists : id , name | sqlite_sequence : name , seq | albums : id , title , artist_id | employees : id , last_name , first_name , title , reports_to , birth_date , hire_date , address , city , state , country , postal_code , phone , fax , email | customers : id , first_name , last_name , company , address , city , state , country , postal_code , phone , fax , email , support_rep_id | genres : id , name | invoices : id , customer_id , invoice_date , billing_address , billing_city , billing_state , billing_country , billing_postal_code , total | media_types : id , name | tracks : id , name , album_id , media_type_id , genre_id , composer , milliseconds , bytes , unit_price | invoice_lines : id , invoice_id , track_id , unit_price , quantity | playlists : id , name | playlist_tracks : playlist_id , track_id	select t2.first_name , t2.last_name , count(t1.reports_to) from employees as t1 join employees as t2 on t1.reports_to = t2.id group by t1.reports_to order by count(t1.reports_to) desc limit 1;
customers_card_transactions: what is the customer id with most number of cards, and how many does he have? | accounts : account_id , customer_id , account_name , other_account_details | customers : customer_id , customer_first_name , customer_last_name , customer_address , customer_phone , customer_email , other_customer_details | customers_cards : card_id , customer_id , card_type_code , card_number , date_valid_from , date_valid_to , other_card_details | financial_transactions : transaction_id , previous_transaction_id , account_id , card_id , transaction_type , transaction_date , transaction_amount , transaction_comment , other_transaction_details	select customer_id , count(*) from customers_cards group by customer_id order by count(*) desc limit 1
customers_card_transactions: what is the card type code with most number of cards? | accounts : account_id , customer_id , account_name , other_account_details | customers : customer_id , customer_first_name , customer_last_name , customer_address , customer_phone , customer_email , other_customer_details | customers_cards : card_id , customer_id , card_type_code , card_number , date_valid_from , date_valid_to , other_card_details | financial_transactions : transaction_id , previous_transaction_id , account_id , card_id , transaction_type , transaction_date , transaction_amount , transaction_comment , other_transaction_details	select card_type_code from customers_cards group by card_type_code order by count(*) desc limit 1
chinook_1: what is the name of the artist with the greatest number of albums? | album : albumid , title , artistid | artist : artistid , name | customer : customerid , firstname , lastname , company , address , city , state , country , postalcode , phone , fax , email , supportrepid | employee : employeeid , lastname , firstname , title , reportsto , birthdate , hiredate , address , city , state , country , postalcode , phone , fax , email | genre : genreid , name | invoice : invoiceid , customerid , invoicedate , billingaddress , billingcity , billingstate , billingcountry , billingpostalcode , total | invoiceline : invoicelineid , invoiceid , trackid , unitprice , quantity | mediatype : mediatypeid , name | playlist : playlistid , name | playlisttrack : playlistid , trackid | track : trackid , name , albumid , mediatypeid , genreid , composer , milliseconds , bytes , unitprice	select t2.name from album as t1 join artist as t2 on t1.artistid = t2.artistid group by t2.name order by count(*) desc limit 1
apartment_rentals: return the apartment number with the largest number of bedrooms. | apartment_buildings : building_id , building_short_name , building_full_name , building_description , building_address , building_manager , building_phone | apartments : apt_id , building_id , apt_type_code , apt_number , bathroom_count , bedroom_count , room_count | apartment_facilities : apt_id , facility_code | guests : guest_id , gender_code , guest_first_name , guest_last_name , date_of_birth | apartment_bookings : apt_booking_id , apt_id , guest_id , booking_status_code , booking_start_date , booking_end_date | view_unit_status : apt_id , apt_booking_id , status_date , available_yn	select apt_number from apartments order by bedroom_count desc limit 1
apartment_rentals: show the apartment type code that has the largest number of total rooms, together with the number of bathrooms and number of bedrooms. | apartment_buildings : building_id , building_short_name , building_full_name , building_description , building_address , building_manager , building_phone | apartments : apt_id , building_id , apt_type_code , apt_number , bathroom_count , bedroom_count , room_count | apartment_facilities : apt_id , facility_code | guests : guest_id , gender_code , guest_first_name , guest_last_name , date_of_birth | apartment_bookings : apt_booking_id , apt_id , guest_id , booking_status_code , booking_start_date , booking_end_date | view_unit_status : apt_id , apt_booking_id , status_date , available_yn	select apt_type_code , bathroom_count , bedroom_count from apartments group by apt_type_code order by sum(room_count) desc limit 1
apartment_rentals: which apartment type has the largest number of total rooms? return the apartment type code, its number of bathrooms and number of bedrooms. | apartment_buildings : building_id , building_short_name , building_full_name , building_description , building_address , building_manager , building_phone | apartments : apt_id , building_id , apt_type_code , apt_number , bathroom_count , bedroom_count , room_count | apartment_facilities : apt_id , facility_code | guests : guest_id , gender_code , guest_first_name , guest_last_name , date_of_birth | apartment_bookings : apt_booking_id , apt_id , guest_id , booking_status_code , booking_start_date , booking_end_date | view_unit_status : apt_id , apt_booking_id , status_date , available_yn	select apt_type_code , bathroom_count , bedroom_count from apartments group by apt_type_code order by sum(room_count) desc limit 1
college_2: which year had the greatest number of courses? | classroom : building , room_number , capacity | department : dept_name , building , budget | course : course_id , title , dept_name , credits | instructor : id , name , dept_name , salary | section : course_id , sec_id , semester , year , building , room_number , time_slot_id | teaches : id , course_id , sec_id , semester , year | student : id , name , dept_name , tot_cred | takes : id , course_id , sec_id , semester , year , grade | advisor : s_id , i_id | time_slot : time_slot_id , day , start_hr , start_min , end_hr , end_min | prereq : course_id , prereq_id	select year from section group by year order by count(*) desc limit 1
college_2: find the year and semester when offers the largest number of courses. | classroom : building , room_number , capacity | department : dept_name , building , budget | course : course_id , title , dept_name , credits | instructor : id , name , dept_name , salary | section : course_id , sec_id , semester , year , building , room_number , time_slot_id | teaches : id , course_id , sec_id , semester , year | student : id , name , dept_name , tot_cred | takes : id , course_id , sec_id , semester , year , grade | advisor : s_id , i_id | time_slot : time_slot_id , day , start_hr , start_min , end_hr , end_min | prereq : course_id , prereq_id	select semester , year from section group by semester , year order by count(*) desc limit 1
college_2: what is the name of the instructor who advises the student with the greatest number of total credits? | classroom : building , room_number , capacity | department : dept_name , building , budget | course : course_id , title , dept_name , credits | instructor : id , name , dept_name , salary | section : course_id , sec_id , semester , year , building , room_number , time_slot_id | teaches : id , course_id , sec_id , semester , year | student : id , name , dept_name , tot_cred | takes : id , course_id , sec_id , semester , year , grade | advisor : s_id , i_id | time_slot : time_slot_id , day , start_hr , start_min , end_hr , end_min | prereq : course_id , prereq_id	select t2.name from advisor as t1 join instructor as t2 on t1.i_id = t2.id join student as t3 on t1.s_id = t3.id order by t3.tot_cred desc limit 1
customers_and_invoices: what is the customer id, first and last name with most number of accounts. | customers : customer_id , customer_first_name , customer_middle_initial , customer_last_name , gender , email_address , login_name , login_password , phone_number , town_city , state_county_province , country | orders : order_id , customer_id , date_order_placed , order_details | invoices : invoice_number , order_id , invoice_date | accounts : account_id , customer_id , date_account_opened , account_name , other_account_details | product_categories : production_type_code , product_type_description , vat_rating | products : product_id , parent_product_id , production_type_code , unit_price , product_name , product_color , product_size | financial_transactions : transaction_id , account_id , invoice_number , transaction_type , transaction_date , transaction_amount , transaction_comment , other_transaction_details | order_items : order_item_id , order_id , product_id , product_quantity , other_order_item_details | invoice_line_items : order_item_id , invoice_number , product_id , product_title , product_quantity , product_price , derived_product_cost , derived_vat_payable , derived_total_cost	select t1.customer_id , t2.customer_first_name , t2.customer_last_name from accounts as t1 join customers as t2 on t1.customer_id = t2.customer_id group by t1.customer_id order by count(*) desc limit 1
customers_and_invoices: show the account id with most number of transactions. | customers : customer_id , customer_first_name , customer_middle_initial , customer_last_name , gender , email_address , login_name , login_password , phone_number , town_city , state_county_province , country | orders : order_id , customer_id , date_order_placed , order_details | invoices : invoice_number , order_id , invoice_date | accounts : account_id , customer_id , date_account_opened , account_name , other_account_details | product_categories : production_type_code , product_type_description , vat_rating | products : product_id , parent_product_id , production_type_code , unit_price , product_name , product_color , product_size | financial_transactions : transaction_id , account_id , invoice_number , transaction_type , transaction_date , transaction_amount , transaction_comment , other_transaction_details | order_items : order_item_id , order_id , product_id , product_quantity , other_order_item_details | invoice_line_items : order_item_id , invoice_number , product_id , product_title , product_quantity , product_price , derived_product_cost , derived_vat_payable , derived_total_cost	select account_id from financial_transactions group by account_id order by count(*) desc limit 1
customers_and_invoices: what is the invoice number and invoice date for the invoice with most number of transactions? | customers : customer_id , customer_first_name , customer_middle_initial , customer_last_name , gender , email_address , login_name , login_password , phone_number , town_city , state_county_province , country | orders : order_id , customer_id , date_order_placed , order_details | invoices : invoice_number , order_id , invoice_date | accounts : account_id , customer_id , date_account_opened , account_name , other_account_details | product_categories : production_type_code , product_type_description , vat_rating | products : product_id , parent_product_id , production_type_code , unit_price , product_name , product_color , product_size | financial_transactions : transaction_id , account_id , invoice_number , transaction_type , transaction_date , transaction_amount , transaction_comment , other_transaction_details | order_items : order_item_id , order_id , product_id , product_quantity , other_order_item_details | invoice_line_items : order_item_id , invoice_number , product_id , product_title , product_quantity , product_price , derived_product_cost , derived_vat_payable , derived_total_cost	select t2.invoice_number , t2.invoice_date from financial_transactions as t1 join invoices as t2 on t1.invoice_number = t2.invoice_number group by t1.invoice_number order by count(*) desc limit 1
customers_and_invoices: what is the invoice number and invoice date corresponding to the invoice with the greatest number of transactions? | customers : customer_id , customer_first_name , customer_middle_initial , customer_last_name , gender , email_address , login_name , login_password , phone_number , town_city , state_county_province , country | orders : order_id , customer_id , date_order_placed , order_details | invoices : invoice_number , order_id , invoice_date | accounts : account_id , customer_id , date_account_opened , account_name , other_account_details | product_categories : production_type_code , product_type_description , vat_rating | products : product_id , parent_product_id , production_type_code , unit_price , product_name , product_color , product_size | financial_transactions : transaction_id , account_id , invoice_number , transaction_type , transaction_date , transaction_amount , transaction_comment , other_transaction_details | order_items : order_item_id , order_id , product_id , product_quantity , other_order_item_details | invoice_line_items : order_item_id , invoice_number , product_id , product_title , product_quantity , product_price , derived_product_cost , derived_vat_payable , derived_total_cost	select t2.invoice_number , t2.invoice_date from financial_transactions as t1 join invoices as t2 on t1.invoice_number = t2.invoice_number group by t1.invoice_number order by count(*) desc limit 1
customers_and_invoices: what is the customer last name, id and phone number with most number of orders? | customers : customer_id , customer_first_name , customer_middle_initial , customer_last_name , gender , email_address , login_name , login_password , phone_number , town_city , state_county_province , country | orders : order_id , customer_id , date_order_placed , order_details | invoices : invoice_number , order_id , invoice_date | accounts : account_id , customer_id , date_account_opened , account_name , other_account_details | product_categories : production_type_code , product_type_description , vat_rating | products : product_id , parent_product_id , production_type_code , unit_price , product_name , product_color , product_size | financial_transactions : transaction_id , account_id , invoice_number , transaction_type , transaction_date , transaction_amount , transaction_comment , other_transaction_details | order_items : order_item_id , order_id , product_id , product_quantity , other_order_item_details | invoice_line_items : order_item_id , invoice_number , product_id , product_title , product_quantity , product_price , derived_product_cost , derived_vat_payable , derived_total_cost	select t2.customer_last_name , t1.customer_id , t2.phone_number from orders as t1 join customers as t2 on t1.customer_id = t2.customer_id group by t1.customer_id order by count(*) desc limit 1
customers_and_invoices: return the last name, id and phone number of the customer who has made the greatest number of orders. | customers : customer_id , customer_first_name , customer_middle_initial , customer_last_name , gender , email_address , login_name , login_password , phone_number , town_city , state_county_province , country | orders : order_id , customer_id , date_order_placed , order_details | invoices : invoice_number , order_id , invoice_date | accounts : account_id , customer_id , date_account_opened , account_name , other_account_details | product_categories : production_type_code , product_type_description , vat_rating | products : product_id , parent_product_id , production_type_code , unit_price , product_name , product_color , product_size | financial_transactions : transaction_id , account_id , invoice_number , transaction_type , transaction_date , transaction_amount , transaction_comment , other_transaction_details | order_items : order_item_id , order_id , product_id , product_quantity , other_order_item_details | invoice_line_items : order_item_id , invoice_number , product_id , product_title , product_quantity , product_price , derived_product_cost , derived_vat_payable , derived_total_cost	select t2.customer_last_name , t1.customer_id , t2.phone_number from orders as t1 join customers as t2 on t1.customer_id = t2.customer_id group by t1.customer_id order by count(*) desc limit 1
formula_1: find the id and surname of the driver who participated the most number of races? | circuits : circuitid , circuitref , name , location , country , lat , lng , alt , url | races : raceid , year , round , circuitid , name , date , time , url | drivers : driverid , driverref , number , code , forename , surname , dob , nationality , url | status : statusid , status | seasons : year , url | constructors : constructorid , constructorref , name , nationality , url | constructorstandings : constructorstandingsid , raceid , constructorid , points , position , positiontext , wins | results : resultid , raceid , driverid , constructorid , number , grid , position , positiontext , positionorder , points , laps , time , milliseconds , fastestlap , rank , fastestlaptime , fastestlapspeed , statusid | driverstandings : driverstandingsid , raceid , driverid , points , position , positiontext , wins | constructorresults : constructorresultsid , raceid , constructorid , points , status | qualifying : qualifyid , raceid , driverid , constructorid , number , position , q1 , q2 , q3 | pitstops : raceid , driverid , stop , lap , time , duration , milliseconds | laptimes : raceid , driverid , lap , position , time , milliseconds	select t1.driverid , t1.surname from drivers as t1 join results as t2 on t1.driverid = t2.driverid join races as t3 on t2.raceid = t3.raceid group by t1.driverid order by count(*) desc limit 1
csu_1: how many faculty lines are there in the university that conferred the most number of degrees in year 2002? | campuses : id , campus , location , county , year | csu_fees : campus , year , campusfee | degrees : year , campus , degrees | discipline_enrollments : campus , discipline , year , undergraduate , graduate | enrollments : campus , year , totalenrollment_ay , fte_ay | faculty : campus , year , faculty	select t2.faculty from campuses as t1 join faculty as t2 on t1.id = t2.campus join degrees as t3 on t1.id = t3.campus and t2.year = t3.year where t2.year = 2002 order by t3.degrees desc limit 1
inn_1: which room has the largest number of reservations? | rooms : roomid , roomname , beds , bedtype , maxoccupancy , baseprice , decor | reservations : code , room , checkin , checkout , rate , lastname , firstname , adults , kids	select t2.roomname from reservations as t1 join rooms as t2 on t1.room = t2.roomid group by t1.room order by count(*) desc limit 1;
