ID	Question	Parse
0	college_2: what are the names and budgets of departments with budgets that are greater than the difference of the mean and standard deviation? | classroom : building , room_number , capacity | department : dept_name , building , budget | course : course_id , title , dept_name , credits | instructor : id , name , dept_name , salary | section : course_id , sec_id , semester , year , building , room_number , time_slot_id | teaches : id , course_id , sec_id , semester , year | student : id , name , dept_name , tot_cred | takes : id , course_id , sec_id , semester , year , grade | advisor : s_id , i_id | time_slot : time_slot_id , day , start_hr , start_min , end_hr , end_min | prereq : course_id , prereq_id	select dept_name , budget from department where budget > (select avg(budget) - STDEV(budget) from department)
8	flight_1: show names for all employees with salary greater than the difference of the mean and standard deviation. | flight : flno , origin , destination , distance , departure_date , arrival_date , price , aid | aircraft : aid , name , distance | employee : eid , name , salary | certificate : eid , aid	select name from employee where salary > (select avg(salary) - STDEV(salary) from employee)
11	college_2: find the departments who have a budget greater than the difference of the mean and standard deviation? | classroom : building , room_number , capacity | department : dept_name , building , budget | course : course_id , title , dept_name , credits | instructor : id , name , dept_name , salary | section : course_id , sec_id , semester , year , building , room_number , time_slot_id | teaches : id , course_id , sec_id , semester , year | student : id , name , dept_name , tot_cred | takes : id , course_id , sec_id , semester , year , grade | advisor : s_id , i_id | time_slot : time_slot_id , day , start_hr , start_min , end_hr , end_min | prereq : course_id , prereq_id	select dept_name from department where budget > (select avg(budget) - STDEV(budget) from department)
16	customers_and_invoices: what are the ids for transactions that have an amount greater than the difference of the mean and standard deviation? | customers : customer_id , customer_first_name , customer_middle_initial , customer_last_name , gender , email_address , login_name , login_password , phone_number , town_city , state_county_province , country | orders : order_id , customer_id , date_order_placed , order_details | invoices : invoice_number , order_id , invoice_date | accounts : account_id , customer_id , date_account_opened , account_name , other_account_details | product_categories : production_type_code , product_type_description , vat_rating | products : product_id , parent_product_id , production_type_code , unit_price , product_name , product_color , product_size | financial_transactions : transaction_id , account_id , invoice_number , transaction_type , transaction_date , transaction_amount , transaction_comment , other_transaction_details | order_items : order_item_id , order_id , product_id , product_quantity , other_order_item_details | invoice_line_items : order_item_id , invoice_number , product_id , product_title , product_quantity , product_price , derived_product_cost , derived_vat_payable , derived_total_cost	select transaction_id from financial_transactions where transaction_amount > (select avg(transaction_amount) - STDEV(transaction_amount) from financial_transactions)
23	manufactory_1: what are the names of manufacturers with a revenue that is greater than the difference of the mean and standard deviation? | manufacturers : code , name , headquarter , founder , revenue | products : code , name , price , manufacturer	select name from manufacturers where revenue > (select avg(revenue) - STDEV(revenue) from manufacturers)
