ID	Question	Parse
19	chinook_1: What are the first names of employee where the hire date is the one that is least-frequent? | album : albumid , title , artistid | artist : artistid , name | customer : customerid , firstname , lastname , company , address , city , state , country , postalcode , phone , fax , email , supportrepid | employee : employeeid , lastname , firstname , title , reportsto , birthdate , hiredate , address , city , state , country , postalcode , phone , fax , email | genre : genreid , name | invoice : invoiceid , customerid , invoicedate , billingaddress , billingcity , billingstate , billingcountry , billingpostalcode , total | invoiceline : invoicelineid , invoiceid , trackid , unitprice , quantity | mediatype : mediatypeid , name | playlist : playlistid , name | playlisttrack : playlistid , trackid | track : trackid , name , albumid , mediatypeid , genreid , composer , milliseconds , bytes , unitprice	select FirstName from Employee where HireDate in (select HireDate from Employee group by HireDate order by count(*) desc limit 1)
42	tracking_orders: What are the invoice detailss of invoices where the invoice date is the one that is least-frequent? | customers : customer_id , customer_name , customer_details | invoices : invoice_number , invoice_date , invoice_details | orders : order_id , customer_id , order_status , date_order_placed , order_details | products : product_id , product_name , product_details | order_items : order_item_id , product_id , order_id , order_item_status , order_item_details | shipments : shipment_id , order_id , invoice_number , shipment_tracking_number , shipment_date , other_shipment_details | shipment_items : shipment_id , order_item_id	select invoice_details from Invoices where invoice_date in (select invoice_date from Invoices group by invoice_date order by count(*) desc limit 1)
111	driving_school: Display the last name, customer status code of customers with the least-frequent amount outstanding. | addresses : address_id , line_1_number_building , city , zip_postcode , state_province_county , country | staff : staff_id , staff_address_id , nickname , first_name , middle_name , last_name , date_of_birth , date_joined_staff , date_left_staff | vehicles : vehicle_id , vehicle_details | customers : customer_id , customer_address_id , customer_status_code , date_became_customer , date_of_birth , first_name , last_name , amount_outstanding , email_address , phone_number , cell_mobile_phone_number | customer_payments : customer_id , datetime_payment , payment_method_code , amount_payment | lessons : lesson_id , customer_id , lesson_status_code , staff_id , vehicle_id , lesson_date , lesson_time , price	select last_name , customer_status_code from Customers where amount_outstanding in (select amount_outstanding from Customers group by amount_outstanding order by count(*) desc limit 1)
148	bike_1: Display the start station name, end station name of trip with the least-frequent zip code. | station : id , name , lat , long , dock_count , city , installation_date | status : station_id , bikes_available , docks_available , time | trip : id , duration , start_date , start_station_name , start_station_id , end_date , end_station_name , end_station_id , bike_id , subscription_type , zip_code | weather : date , max_temperature_f , mean_temperature_f , min_temperature_f , max_dew_point_f , mean_dew_point_f , min_dew_point_f , max_humidity , mean_humidity , min_humidity , max_sea_level_pressure_inches , mean_sea_level_pressure_inches , min_sea_level_pressure_inches , max_visibility_miles , mean_visibility_miles , min_visibility_miles , max_wind_speed_mph , mean_wind_speed_mph , max_gust_speed_mph , precipitation_inches , cloud_cover , events , wind_dir_degrees , zip_code	select start_station_name , end_station_name from trip where zip_code in (select zip_code from trip group by zip_code order by count(*) desc limit 1)
156	customers_and_addresses: Display the contact number, channel code of customer contact channels with the least-frequent active to date. | addresses : address_id , address_content , city , zip_postcode , state_province_county , country , other_address_details | products : product_id , product_details | customers : customer_id , payment_method , customer_name , date_became_customer , other_customer_details | customer_addresses : customer_id , address_id , date_address_from , address_type , date_address_to | customer_contact_channels : customer_id , channel_code , active_from_date , active_to_date , contact_number | customer_orders : order_id , customer_id , order_status , order_date , order_details | order_items : order_id , product_id , order_quantity	select contact_number , channel_code from Customer_Contact_Channels where active_to_date in (select active_to_date from Customer_Contact_Channels group by active_to_date order by count(*) desc limit 1)
