Question	Parse
student_assessment: list the id of students who never attends courses? | addresses : address_id , line_1 , line_2 , city , zip_postcode , state_province_county , country | people : person_id , first_name , middle_name , last_name , cell_mobile_number , email_address , login_name , password | students : student_id , student_details | courses : course_id , course_name , course_description , other_details | people_addresses : person_address_id , person_id , address_id , date_from , date_to | student_course_registrations : student_id , course_id , registration_date | student_course_attendance : student_id , course_id , date_of_attendance | candidates : candidate_id , candidate_details | candidate_assessments : candidate_id , qualification , assessment_date , asessment_outcome_code	select student_id from students where student_id not in (select student_id from student_course_attendance)
student_assessment: what are the  ids of every student who has never attended a course? | addresses : address_id , line_1 , line_2 , city , zip_postcode , state_province_county , country | people : person_id , first_name , middle_name , last_name , cell_mobile_number , email_address , login_name , password | students : student_id , student_details | courses : course_id , course_name , course_description , other_details | people_addresses : person_address_id , person_id , address_id , date_from , date_to | student_course_registrations : student_id , course_id , registration_date | student_course_attendance : student_id , course_id , date_of_attendance | candidates : candidate_id , candidate_details | candidate_assessments : candidate_id , qualification , assessment_date , asessment_outcome_code	select student_id from students where student_id not in (select student_id from student_course_attendance)
student_assessment: what are all info of students who registered courses but not attended courses? | addresses : address_id , line_1 , line_2 , city , zip_postcode , state_province_county , country | people : person_id , first_name , middle_name , last_name , cell_mobile_number , email_address , login_name , password | students : student_id , student_details | courses : course_id , course_name , course_description , other_details | people_addresses : person_address_id , person_id , address_id , date_from , date_to | student_course_registrations : student_id , course_id , registration_date | student_course_attendance : student_id , course_id , date_of_attendance | candidates : candidate_id , candidate_details | candidate_assessments : candidate_id , qualification , assessment_date , asessment_outcome_code	select * from student_course_registrations where student_id not in (select student_id from student_course_attendance)
student_assessment: what are all details of the students who registered but did not attend any course? | addresses : address_id , line_1 , line_2 , city , zip_postcode , state_province_county , country | people : person_id , first_name , middle_name , last_name , cell_mobile_number , email_address , login_name , password | students : student_id , student_details | courses : course_id , course_name , course_description , other_details | people_addresses : person_address_id , person_id , address_id , date_from , date_to | student_course_registrations : student_id , course_id , registration_date | student_course_attendance : student_id , course_id , date_of_attendance | candidates : candidate_id , candidate_details | candidate_assessments : candidate_id , qualification , assessment_date , asessment_outcome_code	select * from student_course_registrations where student_id not in (select student_id from student_course_attendance)
bike_1: what is the average bike availability in stations that are not located in palo alto? | station : id , name , lat , long , dock_count , city , installation_date | status : station_id , bikes_available , docks_available , time | trip : id , duration , start_date , start_station_name , start_station_id , end_date , end_station_name , end_station_id , bike_id , subscription_type , zip_code | weather : date , max_temperature_f , mean_temperature_f , min_temperature_f , max_dew_point_f , mean_dew_point_f , min_dew_point_f , max_humidity , mean_humidity , min_humidity , max_sea_level_pressure_inches , mean_sea_level_pressure_inches , min_sea_level_pressure_inches , max_visibility_miles , mean_visibility_miles , min_visibility_miles , max_wind_speed_mph , mean_wind_speed_mph , max_gust_speed_mph , precipitation_inches , cloud_cover , events , wind_dir_degrees , zip_code	"select avg(bikes_available) from status where station_id not in (select id from station where city = ""palo alto"")"
bike_1: what is the average bike availablility for stations not in palo alto? | station : id , name , lat , long , dock_count , city , installation_date | status : station_id , bikes_available , docks_available , time | trip : id , duration , start_date , start_station_name , start_station_id , end_date , end_station_name , end_station_id , bike_id , subscription_type , zip_code | weather : date , max_temperature_f , mean_temperature_f , min_temperature_f , max_dew_point_f , mean_dew_point_f , min_dew_point_f , max_humidity , mean_humidity , min_humidity , max_sea_level_pressure_inches , mean_sea_level_pressure_inches , min_sea_level_pressure_inches , max_visibility_miles , mean_visibility_miles , min_visibility_miles , max_wind_speed_mph , mean_wind_speed_mph , max_gust_speed_mph , precipitation_inches , cloud_cover , events , wind_dir_degrees , zip_code	"select avg(bikes_available) from status where station_id not in (select id from station where city = ""palo alto"")"
allergy_1: list the first and last name of the students who do not have any food type allergy. | allergy_type : allergy , allergytype | has_allergy : stuid , allergy | student : stuid , lname , fname , age , sex , major , advisor , city_code	"select fname , lname from student where stuid not in (select t1.stuid from has_allergy as t1 join allergy_type as t2 on t1.allergy = t2.allergy where t2.allergytype = ""food"")"
allergy_1: what is the full name of each student who is not allergic to any type of food. | allergy_type : allergy , allergytype | has_allergy : stuid , allergy | student : stuid , lname , fname , age , sex , major , advisor , city_code	"select fname , lname from student where stuid not in (select t1.stuid from has_allergy as t1 join allergy_type as t2 on t1.allergy = t2.allergy where t2.allergytype = ""food"")"
allergy_1: find the number of students who are older than 18 and do not have allergy to either food or animal. | allergy_type : allergy , allergytype | has_allergy : stuid , allergy | student : stuid , lname , fname , age , sex , major , advisor , city_code	"select count(*) from student where age > 18 and stuid not in ( select stuid from has_allergy as t1 join allergy_type as t2 on t1.allergy = t2.allergy where t2.allergytype = ""food"" or t2.allergytype = ""animal"")"
allergy_1: how many students are over 18 and do not have allergy to food type or animal type? | allergy_type : allergy , allergytype | has_allergy : stuid , allergy | student : stuid , lname , fname , age , sex , major , advisor , city_code	"select count(*) from student where age > 18 and stuid not in ( select stuid from has_allergy as t1 join allergy_type as t2 on t1.allergy = t2.allergy where t2.allergytype = ""food"" or t2.allergytype = ""animal"")"
allergy_1: find the first name and major of the students who are not allegry to soy. | allergy_type : allergy , allergytype | has_allergy : stuid , allergy | student : stuid , lname , fname , age , sex , major , advisor , city_code	"select fname , major from student where stuid not in (select stuid from has_allergy where allergy = ""soy"")"
customers_card_transactions: show the number of all customers without an account. | accounts : account_id , customer_id , account_name , other_account_details | customers : customer_id , customer_first_name , customer_last_name , customer_address , customer_phone , customer_email , other_customer_details | customers_cards : card_id , customer_id , card_type_code , card_number , date_valid_from , date_valid_to , other_card_details | financial_transactions : transaction_id , previous_transaction_id , account_id , card_id , transaction_type , transaction_date , transaction_amount , transaction_comment , other_transaction_details	select count(*) from customers where customer_id not in (select customer_id from accounts)
customers_card_transactions: how many customers do not have an account? | accounts : account_id , customer_id , account_name , other_account_details | customers : customer_id , customer_first_name , customer_last_name , customer_address , customer_phone , customer_email , other_customer_details | customers_cards : card_id , customer_id , card_type_code , card_number , date_valid_from , date_valid_to , other_card_details | financial_transactions : transaction_id , previous_transaction_id , account_id , card_id , transaction_type , transaction_date , transaction_amount , transaction_comment , other_transaction_details	select count(*) from customers where customer_id not in (select customer_id from accounts)
chinook_1: how many artists do not have any album? | album : albumid , title , artistid | artist : artistid , name | customer : customerid , firstname , lastname , company , address , city , state , country , postalcode , phone , fax , email , supportrepid | employee : employeeid , lastname , firstname , title , reportsto , birthdate , hiredate , address , city , state , country , postalcode , phone , fax , email | genre : genreid , name | invoice : invoiceid , customerid , invoicedate , billingaddress , billingcity , billingstate , billingcountry , billingpostalcode , total | invoiceline : invoicelineid , invoiceid , trackid , unitprice , quantity | mediatype : mediatypeid , name | playlist : playlistid , name | playlisttrack : playlistid , trackid | track : trackid , name , albumid , mediatypeid , genreid , composer , milliseconds , bytes , unitprice	select count(*) from artist where artistid not in(select artistid from album)
chinook_1: cound the number of artists who have not released an album. | album : albumid , title , artistid | artist : artistid , name | customer : customerid , firstname , lastname , company , address , city , state , country , postalcode , phone , fax , email , supportrepid | employee : employeeid , lastname , firstname , title , reportsto , birthdate , hiredate , address , city , state , country , postalcode , phone , fax , email | genre : genreid , name | invoice : invoiceid , customerid , invoicedate , billingaddress , billingcity , billingstate , billingcountry , billingpostalcode , total | invoiceline : invoicelineid , invoiceid , trackid , unitprice , quantity | mediatype : mediatypeid , name | playlist : playlistid , name | playlisttrack : playlistid , trackid | track : trackid , name , albumid , mediatypeid , genreid , composer , milliseconds , bytes , unitprice	select count(*) from artist where artistid not in(select artistid from album)
match_season: what are the names of teams that do no have match season record? | country : country_id , country_name , capital , official_native_language | team : team_id , name | match_season : season , player , position , country , team , draft_pick_number , draft_class , college | player : player_id , player , years_played , total_wl , singles_wl , doubles_wl , team	select name from team where team_id not in (select team from match_season)
match_season: return the names of teams that have no match season record. | country : country_id , country_name , capital , official_native_language | team : team_id , name | match_season : season , player , position , country , team , draft_pick_number , draft_class , college | player : player_id , player , years_played , total_wl , singles_wl , doubles_wl , team	select name from team where team_id not in (select team from match_season)
apartment_rentals: how many apartments do not have any facility? | apartment_buildings : building_id , building_short_name , building_full_name , building_description , building_address , building_manager , building_phone | apartments : apt_id , building_id , apt_type_code , apt_number , bathroom_count , bedroom_count , room_count | apartment_facilities : apt_id , facility_code | guests : guest_id , gender_code , guest_first_name , guest_last_name , date_of_birth | apartment_bookings : apt_booking_id , apt_id , guest_id , booking_status_code , booking_start_date , booking_end_date | view_unit_status : apt_id , apt_booking_id , status_date , available_yn	select count(*) from apartments where apt_id not in (select apt_id from apartment_facilities)
apartment_rentals: find the number of apartments that have no facility. | apartment_buildings : building_id , building_short_name , building_full_name , building_description , building_address , building_manager , building_phone | apartments : apt_id , building_id , apt_type_code , apt_number , bathroom_count , bedroom_count , room_count | apartment_facilities : apt_id , facility_code | guests : guest_id , gender_code , guest_first_name , guest_last_name , date_of_birth | apartment_bookings : apt_booking_id , apt_id , guest_id , booking_status_code , booking_start_date , booking_end_date | view_unit_status : apt_id , apt_booking_id , status_date , available_yn	select count(*) from apartments where apt_id not in (select apt_id from apartment_facilities)
college_2: how many courses that do not have prerequisite? | classroom : building , room_number , capacity | department : dept_name , building , budget | course : course_id , title , dept_name , credits | instructor : id , name , dept_name , salary | section : course_id , sec_id , semester , year , building , room_number , time_slot_id | teaches : id , course_id , sec_id , semester , year | student : id , name , dept_name , tot_cred | takes : id , course_id , sec_id , semester , year , grade | advisor : s_id , i_id | time_slot : time_slot_id , day , start_hr , start_min , end_hr , end_min | prereq : course_id , prereq_id	select count(*) from course where course_id not in (select course_id from prereq)
college_2: count the number of courses without prerequisites. | classroom : building , room_number , capacity | department : dept_name , building , budget | course : course_id , title , dept_name , credits | instructor : id , name , dept_name , salary | section : course_id , sec_id , semester , year , building , room_number , time_slot_id | teaches : id , course_id , sec_id , semester , year | student : id , name , dept_name , tot_cred | takes : id , course_id , sec_id , semester , year , grade | advisor : s_id , i_id | time_slot : time_slot_id , day , start_hr , start_min , end_hr , end_min | prereq : course_id , prereq_id	select count(*) from course where course_id not in (select course_id from prereq)
college_2: find the name of the courses that do not have any prerequisite? | classroom : building , room_number , capacity | department : dept_name , building , budget | course : course_id , title , dept_name , credits | instructor : id , name , dept_name , salary | section : course_id , sec_id , semester , year , building , room_number , time_slot_id | teaches : id , course_id , sec_id , semester , year | student : id , name , dept_name , tot_cred | takes : id , course_id , sec_id , semester , year , grade | advisor : s_id , i_id | time_slot : time_slot_id , day , start_hr , start_min , end_hr , end_min | prereq : course_id , prereq_id	select title from course where course_id not in (select course_id from prereq)
college_2: what are the titles of courses without prerequisites? | classroom : building , room_number , capacity | department : dept_name , building , budget | course : course_id , title , dept_name , credits | instructor : id , name , dept_name , salary | section : course_id , sec_id , semester , year , building , room_number , time_slot_id | teaches : id , course_id , sec_id , semester , year | student : id , name , dept_name , tot_cred | takes : id , course_id , sec_id , semester , year , grade | advisor : s_id , i_id | time_slot : time_slot_id , day , start_hr , start_min , end_hr , end_min | prereq : course_id , prereq_id	select title from course where course_id not in (select course_id from prereq)
college_2: find the name of the courses that do not have any prerequisite? | classroom : building , room_number , capacity | department : dept_name , building , budget | course : course_id , title , dept_name , credits | instructor : id , name , dept_name , salary | section : course_id , sec_id , semester , year , building , room_number , time_slot_id | teaches : id , course_id , sec_id , semester , year | student : id , name , dept_name , tot_cred | takes : id , course_id , sec_id , semester , year , grade | advisor : s_id , i_id | time_slot : time_slot_id , day , start_hr , start_min , end_hr , end_min | prereq : course_id , prereq_id	select title from course where course_id not in (select course_id from prereq)
college_2: find the name of instructors who didn't teach any courses? | classroom : building , room_number , capacity | department : dept_name , building , budget | course : course_id , title , dept_name , credits | instructor : id , name , dept_name , salary | section : course_id , sec_id , semester , year , building , room_number , time_slot_id | teaches : id , course_id , sec_id , semester , year | student : id , name , dept_name , tot_cred | takes : id , course_id , sec_id , semester , year , grade | advisor : s_id , i_id | time_slot : time_slot_id , day , start_hr , start_min , end_hr , end_min | prereq : course_id , prereq_id	select name from instructor where id not in (select id from teaches)
college_2: find the names of instructors who didn't each any courses in any spring semester. | classroom : building , room_number , capacity | department : dept_name , building , budget | course : course_id , title , dept_name , credits | instructor : id , name , dept_name , salary | section : course_id , sec_id , semester , year , building , room_number , time_slot_id | teaches : id , course_id , sec_id , semester , year | student : id , name , dept_name , tot_cred | takes : id , course_id , sec_id , semester , year , grade | advisor : s_id , i_id | time_slot : time_slot_id , day , start_hr , start_min , end_hr , end_min | prereq : course_id , prereq_id	select name from instructor where id not in (select id from teaches where semester = 'spring')
college_2: what are the names of instructors who didn't teach courses in the spring? | classroom : building , room_number , capacity | department : dept_name , building , budget | course : course_id , title , dept_name , credits | instructor : id , name , dept_name , salary | section : course_id , sec_id , semester , year , building , room_number , time_slot_id | teaches : id , course_id , sec_id , semester , year | student : id , name , dept_name , tot_cred | takes : id , course_id , sec_id , semester , year , grade | advisor : s_id , i_id | time_slot : time_slot_id , day , start_hr , start_min , end_hr , end_min | prereq : course_id , prereq_id	select name from instructor where id not in (select id from teaches where semester = 'spring')
college_2: find the name of students who didn't take any course from biology department. | classroom : building , room_number , capacity | department : dept_name , building , budget | course : course_id , title , dept_name , credits | instructor : id , name , dept_name , salary | section : course_id , sec_id , semester , year , building , room_number , time_slot_id | teaches : id , course_id , sec_id , semester , year | student : id , name , dept_name , tot_cred | takes : id , course_id , sec_id , semester , year , grade | advisor : s_id , i_id | time_slot : time_slot_id , day , start_hr , start_min , end_hr , end_min | prereq : course_id , prereq_id	select name from student where id not in (select t1.id from takes as t1 join course as t2 on t1.course_id = t2.course_id where t2.dept_name = 'biology')
college_2: what are the names of students who haven't taken any biology courses? | classroom : building , room_number , capacity | department : dept_name , building , budget | course : course_id , title , dept_name , credits | instructor : id , name , dept_name , salary | section : course_id , sec_id , semester , year , building , room_number , time_slot_id | teaches : id , course_id , sec_id , semester , year | student : id , name , dept_name , tot_cred | takes : id , course_id , sec_id , semester , year , grade | advisor : s_id , i_id | time_slot : time_slot_id , day , start_hr , start_min , end_hr , end_min | prereq : course_id , prereq_id	select name from student where id not in (select t1.id from takes as t1 join course as t2 on t1.course_id = t2.course_id where t2.dept_name = 'biology')
customers_and_invoices: how many customers don't have an account? | customers : customer_id , customer_first_name , customer_middle_initial , customer_last_name , gender , email_address , login_name , login_password , phone_number , town_city , state_county_province , country | orders : order_id , customer_id , date_order_placed , order_details | invoices : invoice_number , order_id , invoice_date | accounts : account_id , customer_id , date_account_opened , account_name , other_account_details | product_categories : production_type_code , product_type_description , vat_rating | products : product_id , parent_product_id , production_type_code , unit_price , product_name , product_color , product_size | financial_transactions : transaction_id , account_id , invoice_number , transaction_type , transaction_date , transaction_amount , transaction_comment , other_transaction_details | order_items : order_item_id , order_id , product_id , product_quantity , other_order_item_details | invoice_line_items : order_item_id , invoice_number , product_id , product_title , product_quantity , product_price , derived_product_cost , derived_vat_payable , derived_total_cost	select count(*) from customers where customer_id not in (select customer_id from accounts)
customers_and_invoices: count the number of customers who do not have an account. | customers : customer_id , customer_first_name , customer_middle_initial , customer_last_name , gender , email_address , login_name , login_password , phone_number , town_city , state_county_province , country | orders : order_id , customer_id , date_order_placed , order_details | invoices : invoice_number , order_id , invoice_date | accounts : account_id , customer_id , date_account_opened , account_name , other_account_details | product_categories : production_type_code , product_type_description , vat_rating | products : product_id , parent_product_id , production_type_code , unit_price , product_name , product_color , product_size | financial_transactions : transaction_id , account_id , invoice_number , transaction_type , transaction_date , transaction_amount , transaction_comment , other_transaction_details | order_items : order_item_id , order_id , product_id , product_quantity , other_order_item_details | invoice_line_items : order_item_id , invoice_number , product_id , product_title , product_quantity , product_price , derived_product_cost , derived_vat_payable , derived_total_cost	select count(*) from customers where customer_id not in (select customer_id from accounts)
customers_and_invoices: how many products were not included in any order? | customers : customer_id , customer_first_name , customer_middle_initial , customer_last_name , gender , email_address , login_name , login_password , phone_number , town_city , state_county_province , country | orders : order_id , customer_id , date_order_placed , order_details | invoices : invoice_number , order_id , invoice_date | accounts : account_id , customer_id , date_account_opened , account_name , other_account_details | product_categories : production_type_code , product_type_description , vat_rating | products : product_id , parent_product_id , production_type_code , unit_price , product_name , product_color , product_size | financial_transactions : transaction_id , account_id , invoice_number , transaction_type , transaction_date , transaction_amount , transaction_comment , other_transaction_details | order_items : order_item_id , order_id , product_id , product_quantity , other_order_item_details | invoice_line_items : order_item_id , invoice_number , product_id , product_title , product_quantity , product_price , derived_product_cost , derived_vat_payable , derived_total_cost	select count(*) from products where product_id not in ( select product_id from order_items )
