Question	Parse
cre_theme_park: how many tourists did not make any visit? | ref_hotel_star_ratings : star_rating_code , star_rating_description | locations : location_id , location_name , address , other_details | ref_attraction_types : attraction_type_code , attraction_type_description | visitors : tourist_id , tourist_details | features : feature_id , feature_details | hotels : hotel_id , star_rating_code , pets_allowed_yn , price_range , other_hotel_details | tourist_attractions : tourist_attraction_id , attraction_type_code , location_id , how_to_get_there , name , description , opening_hours , other_details | street_markets : market_id , market_details | shops : shop_id , shop_details | museums : museum_id , museum_details | royal_family : royal_family_id , royal_family_details | theme_parks : theme_park_id , theme_park_details | visits : visit_id , tourist_attraction_id , tourist_id , visit_date , visit_details | photos : photo_id , tourist_attraction_id , name , description , filename , other_details | staff : staff_id , tourist_attraction_id , name , other_details | tourist_attraction_features : tourist_attraction_id , feature_id	select count(*) from visitors where tourist_id not in ( select tourist_id from visits )
customers_and_addresses: find the list of cities that no customer is living in. | addresses : address_id , address_content , city , zip_postcode , state_province_county , country , other_address_details | products : product_id , product_details | customers : customer_id , payment_method , customer_name , date_became_customer , other_customer_details | customer_addresses : customer_id , address_id , date_address_from , address_type , date_address_to | customer_contact_channels : customer_id , channel_code , active_from_date , active_to_date , contact_number | customer_orders : order_id , customer_id , order_status , order_date , order_details | order_items : order_id , product_id , order_quantity	select city from addresses where city not in ( select distinct t3.city from customers as t1 join customer_addresses as t2 on t1.customer_id = t2.customer_id join addresses as t3 on t2.address_id = t3.address_id)
customers_and_addresses: what are the cities no customers live in? | addresses : address_id , address_content , city , zip_postcode , state_province_county , country , other_address_details | products : product_id , product_details | customers : customer_id , payment_method , customer_name , date_became_customer , other_customer_details | customer_addresses : customer_id , address_id , date_address_from , address_type , date_address_to | customer_contact_channels : customer_id , channel_code , active_from_date , active_to_date , contact_number | customer_orders : order_id , customer_id , order_status , order_date , order_details | order_items : order_id , product_id , order_quantity	select city from addresses where city not in ( select distinct t3.city from customers as t1 join customer_addresses as t2 on t1.customer_id = t2.customer_id join addresses as t3 on t2.address_id = t3.address_id)
music_4: find the famous titles of artists that do not have any volume. | artist : artist_id , artist , age , famous_title , famous_release_date | volume : volume_id , volume_issue , issue_date , weeks_on_top , song , artist_id | music_festival : id , music_festival , date_of_ceremony , category , volume , result	select famous_title from artist where artist_id not in(select artist_id from volume)
cre_docs_and_epenses: how many documents do not have any expense? | ref_document_types : document_type_code , document_type_name , document_type_description | ref_budget_codes : budget_type_code , budget_type_description | projects : project_id , project_details | documents : document_id , document_type_code , project_id , document_date , document_name , document_description , other_details | statements : statement_id , statement_details | documents_with_expenses : document_id , budget_type_code , document_details | accounts : account_id , statement_id , account_details	select count(*) from documents where document_id not in ( select document_id from documents_with_expenses )
cre_docs_and_epenses: count the number of documents that do not have expenses. | ref_document_types : document_type_code , document_type_name , document_type_description | ref_budget_codes : budget_type_code , budget_type_description | projects : project_id , project_details | documents : document_id , document_type_code , project_id , document_date , document_name , document_description , other_details | statements : statement_id , statement_details | documents_with_expenses : document_id , budget_type_code , document_details | accounts : account_id , statement_id , account_details	select count(*) from documents where document_id not in ( select document_id from documents_with_expenses )
wine_1: find the average price of wines that are not produced from sonoma county. | grapes : id , grape , color | appellations : no , appelation , county , state , area , isava | wine : no , grape , winery , appelation , state , name , year , price , score , cases , drink	select avg(price) from wine where appelation not in (select t1.appelation from appellations as t1 join wine as t2 on t1.appelation = t2.appelation where t1.county = 'sonoma')
wine_1: what is the average price for wines not produced in sonoma county? | grapes : id , grape , color | appellations : no , appelation , county , state , area , isava | wine : no , grape , winery , appelation , state , name , year , price , score , cases , drink	select avg(price) from wine where appelation not in (select t1.appelation from appellations as t1 join wine as t2 on t1.appelation = t2.appelation where t1.county = 'sonoma')
driving_school: list the number of customers that did not have any payment history. | addresses : address_id , line_1_number_building , city , zip_postcode , state_province_county , country | staff : staff_id , staff_address_id , nickname , first_name , middle_name , last_name , date_of_birth , date_joined_staff , date_left_staff | vehicles : vehicle_id , vehicle_details | customers : customer_id , customer_address_id , customer_status_code , date_became_customer , date_of_birth , first_name , last_name , amount_outstanding , email_address , phone_number , cell_mobile_phone_number | customer_payments : customer_id , datetime_payment , payment_method_code , amount_payment | lessons : lesson_id , customer_id , lesson_status_code , staff_id , vehicle_id , lesson_date , lesson_time , price	select count(*) from customers where customer_id not in ( select customer_id from customer_payments );
driving_school: how many customers have no payment histories? | addresses : address_id , line_1_number_building , city , zip_postcode , state_province_county , country | staff : staff_id , staff_address_id , nickname , first_name , middle_name , last_name , date_of_birth , date_joined_staff , date_left_staff | vehicles : vehicle_id , vehicle_details | customers : customer_id , customer_address_id , customer_status_code , date_became_customer , date_of_birth , first_name , last_name , amount_outstanding , email_address , phone_number , cell_mobile_phone_number | customer_payments : customer_id , datetime_payment , payment_method_code , amount_payment | lessons : lesson_id , customer_id , lesson_status_code , staff_id , vehicle_id , lesson_date , lesson_time , price	select count(*) from customers where customer_id not in ( select customer_id from customer_payments );
