Question	Parse
customers_and_invoices: count the number of products that were never ordered. | customers : customer_id , customer_first_name , customer_middle_initial , customer_last_name , gender , email_address , login_name , login_password , phone_number , town_city , state_county_province , country | orders : order_id , customer_id , date_order_placed , order_details | invoices : invoice_number , order_id , invoice_date | accounts : account_id , customer_id , date_account_opened , account_name , other_account_details | product_categories : production_type_code , product_type_description , vat_rating | products : product_id , parent_product_id , production_type_code , unit_price , product_name , product_color , product_size | financial_transactions : transaction_id , account_id , invoice_number , transaction_type , transaction_date , transaction_amount , transaction_comment , other_transaction_details | order_items : order_item_id , order_id , product_id , product_quantity , other_order_item_details | invoice_line_items : order_item_id , invoice_number , product_id , product_title , product_quantity , product_price , derived_product_cost , derived_vat_payable , derived_total_cost	select count(*) from products where product_id not in ( select product_id from order_items )
formula_1: how many drivers did not participate in the races held in 2009? | circuits : circuitid , circuitref , name , location , country , lat , lng , alt , url | races : raceid , year , round , circuitid , name , date , time , url | drivers : driverid , driverref , number , code , forename , surname , dob , nationality , url | status : statusid , status | seasons : year , url | constructors : constructorid , constructorref , name , nationality , url | constructorstandings : constructorstandingsid , raceid , constructorid , points , position , positiontext , wins | results : resultid , raceid , driverid , constructorid , number , grid , position , positiontext , positionorder , points , laps , time , milliseconds , fastestlap , rank , fastestlaptime , fastestlapspeed , statusid | driverstandings : driverstandingsid , raceid , driverid , points , position , positiontext , wins | constructorresults : constructorresultsid , raceid , constructorid , points , status | qualifying : qualifyid , raceid , driverid , constructorid , number , position , q1 , q2 , q3 | pitstops : raceid , driverid , stop , lap , time , duration , milliseconds | laptimes : raceid , driverid , lap , position , time , milliseconds	select count(distinct driverid) from results where raceid not in( select raceid from races where year != 2009 )
formula_1: how many drivers did not race in 2009? | circuits : circuitid , circuitref , name , location , country , lat , lng , alt , url | races : raceid , year , round , circuitid , name , date , time , url | drivers : driverid , driverref , number , code , forename , surname , dob , nationality , url | status : statusid , status | seasons : year , url | constructors : constructorid , constructorref , name , nationality , url | constructorstandings : constructorstandingsid , raceid , constructorid , points , position , positiontext , wins | results : resultid , raceid , driverid , constructorid , number , grid , position , positiontext , positionorder , points , laps , time , milliseconds , fastestlap , rank , fastestlaptime , fastestlapspeed , statusid | driverstandings : driverstandingsid , raceid , driverid , points , position , positiontext , wins | constructorresults : constructorresultsid , raceid , constructorid , points , status | qualifying : qualifyid , raceid , driverid , constructorid , number , position , q1 , q2 , q3 | pitstops : raceid , driverid , stop , lap , time , duration , milliseconds | laptimes : raceid , driverid , lap , position , time , milliseconds	select count(distinct driverid) from results where raceid not in( select raceid from races where year != 2009 )
movie_1: find the titles of all movies that have no ratings. | movie : mid , title , year , director | reviewer : rid , name | rating : rid , mid , stars , ratingdate	select title from movie where mid not in (select mid from rating)
movie_1: what are the titles of all movies that have not been rated? | movie : mid , title , year , director | reviewer : rid , name | rating : rid , mid , stars , ratingdate	select title from movie where mid not in (select mid from rating)
movie_1: find the average rating star for each movie that are not reviewed by brittany harris. | movie : mid , title , year , director | reviewer : rid , name | rating : rid , mid , stars , ratingdate	"select mid , avg(stars) from rating where mid not in (select t1.mid from rating as t1 join reviewer as t2 on t1.rid = t2.rid where t2.name = ""brittany harris"") group by mid"
inn_1: find the number of rooms that do not have any reservation. | rooms : roomid , roomname , beds , bedtype , maxoccupancy , baseprice , decor | reservations : code , room , checkin , checkout , rate , lastname , firstname , adults , kids	select count(*) from rooms where roomid not in (select distinct room from reservations)
inn_1: how many rooms have not had any reservation yet? | rooms : roomid , roomname , beds , bedtype , maxoccupancy , baseprice , decor | reservations : code , room , checkin , checkout , rate , lastname , firstname , adults , kids	select count(*) from rooms where roomid not in (select distinct room from reservations)
election: what are the names of parties that do not have delegates in election? | county : county_id , county_name , population , zip_code | party : party_id , year , party , governor , lieutenant_governor , comptroller , attorney_general , us_senate | election : election_id , counties_represented , district , delegate , party , first_elected , committee	select party from party where party_id not in (select party from election)
election: which parties did not have any delegates in elections? | county : county_id , county_name , population , zip_code | party : party_id , year , party , governor , lieutenant_governor , comptroller , attorney_general , us_senate | election : election_id , counties_represented , district , delegate , party , first_elected , committee	select party from party where party_id not in (select party from election)
sakila_1: return the first names of customers who did not rented a film after the date '2005-08-23 02:06:01'. | actor : actor_id , first_name , last_name , last_update | address : address_id , address , address2 , district , city_id , postal_code , phone , last_update | category : category_id , name , last_update | city : city_id , city , country_id , last_update | country : country_id , country , last_update | customer : customer_id , store_id , first_name , last_name , email , address_id , active , create_date , last_update | film : film_id , title , description , release_year , language_id , original_language_id , rental_duration , rental_rate , length , replacement_cost , rating , special_features , last_update | film_actor : actor_id , film_id , last_update | film_category : film_id , category_id , last_update | film_text : film_id , title , description | inventory : inventory_id , film_id , store_id , last_update | language : language_id , name , last_update | payment : payment_id , customer_id , staff_id , rental_id , amount , payment_date , last_update | rental : rental_id , rental_date , inventory_id , customer_id , return_date , staff_id , last_update | staff : staff_id , first_name , last_name , address_id , picture , email , store_id , active , username , password , last_update | store : store_id , manager_staff_id , address_id , last_update	select first_name from customer where customer_id not in( select customer_id from rental where rental_date > '2005-08-23 02:06:01' )
loan_1: find the average credit score of the customers who do not have any loan. | bank : branch_id , bname , no_of_customers , city , state | customer : cust_id , cust_name , acc_type , acc_bal , no_of_loans , credit_score , branch_id , state | loan : loan_id , loan_type , cust_id , branch_id , amount	select avg(credit_score) from customer where cust_id not in (select cust_id from loan)
loan_1: what is the average credit score for customers who have never taken a loan? | bank : branch_id , bname , no_of_customers , city , state | customer : cust_id , cust_name , acc_type , acc_bal , no_of_loans , credit_score , branch_id , state | loan : loan_id , loan_type , cust_id , branch_id , amount	select avg(credit_score) from customer where cust_id not in (select cust_id from loan)
sports_competition: list the names of clubs that do not have any players. | club : club_id , name , region , start_year | club_rank : rank , club_id , gold , silver , bronze , total | player : player_id , name , position , club_id , apps , tries , goals , points | competition : competition_id , year , competition_type , country | competition_result : competition_id , club_id_1 , club_id_2 , score	select name from club where club_id not in (select club_id from player)
hr_1: find the ids of the employees who does not work in those departments where some employees works whose manager id within the range 100 and 200. | regions : region_id , region_name | countries : country_id , country_name , region_id | departments : department_id , department_name , manager_id , location_id | jobs : job_id , job_title , min_salary , max_salary | employees : employee_id , first_name , last_name , email , phone_number , hire_date , job_id , salary , commission_pct , manager_id , department_id | job_history : employee_id , start_date , end_date , job_id , department_id | locations : location_id , street_address , postal_code , city , state_province , country_id	select * from employees where department_id not in (select department_id from departments where manager_id between 100 and 200)
hr_1: what are the ids for employees who do not work in departments with managers that have ids between 100 and 200? | regions : region_id , region_name | countries : country_id , country_name , region_id | departments : department_id , department_name , manager_id , location_id | jobs : job_id , job_title , min_salary , max_salary | employees : employee_id , first_name , last_name , email , phone_number , hire_date , job_id , salary , commission_pct , manager_id , department_id | job_history : employee_id , start_date , end_date , job_id , department_id | locations : location_id , street_address , postal_code , city , state_province , country_id	select * from employees where department_id not in (select department_id from departments where manager_id between 100 and 200)
hr_1: display all the information of those employees who did not have any job in the past. | regions : region_id , region_name | countries : country_id , country_name , region_id | departments : department_id , department_name , manager_id , location_id | jobs : job_id , job_title , min_salary , max_salary | employees : employee_id , first_name , last_name , email , phone_number , hire_date , job_id , salary , commission_pct , manager_id , department_id | job_history : employee_id , start_date , end_date , job_id , department_id | locations : location_id , street_address , postal_code , city , state_province , country_id	select * from employees where employee_id not in (select employee_id from job_history)
e_learning: how many students did not have any course enrollment? | course_authors_and_tutors : author_id , author_tutor_atb , login_name , password , personal_name , middle_name , family_name , gender_mf , address_line_1 | students : student_id , date_of_registration , date_of_latest_logon , login_name , password , personal_name , middle_name , family_name | subjects : subject_id , subject_name | courses : course_id , author_id , subject_id , course_name , course_description | student_course_enrolment : registration_id , student_id , course_id , date_of_enrolment , date_of_completion | student_tests_taken : registration_id , date_test_taken , test_result	select count(*) from students where student_id not in (select student_id from student_course_enrolment)
e_learning: count the number of students who did not enroll in any course. | course_authors_and_tutors : author_id , author_tutor_atb , login_name , password , personal_name , middle_name , family_name , gender_mf , address_line_1 | students : student_id , date_of_registration , date_of_latest_logon , login_name , password , personal_name , middle_name , family_name | subjects : subject_id , subject_name | courses : course_id , author_id , subject_id , course_name , course_description | student_course_enrolment : registration_id , student_id , course_id , date_of_enrolment , date_of_completion | student_tests_taken : registration_id , date_test_taken , test_result	select count(*) from students where student_id not in (select student_id from student_course_enrolment)
hospital_1: find the number of patients who are not using the medication of procrastin-x. | physician : employeeid , name , position , ssn | department : departmentid , name , head | affiliated_with : physician , department , primaryaffiliation | procedures : code , name , cost | trained_in : physician , treatment , certificationdate , certificationexpires | patient : ssn , name , address , phone , insuranceid , pcp | nurse : employeeid , name , position , registered , ssn | appointment : appointmentid , patient , prepnurse , physician , start , end , examinationroom | medication : code , name , brand , description | prescribes : physician , patient , medication , date , appointment , dose | block : blockfloor , blockcode | room : roomnumber , roomtype , blockfloor , blockcode , unavailable | on_call : nurse , blockfloor , blockcode , oncallstart , oncallend | stay : stayid , patient , room , staystart , stayend | undergoes : patient , procedures , stay , dateundergoes , physician , assistingnurse	select count(*) from patient where ssn not in ( select t1.patient from prescribes as t1 join medication as t2 on t1.medication = t2.code where t2.name = 'procrastin-x' )
hospital_1: how many patients are not using procrastin-x as medication? | physician : employeeid , name , position , ssn | department : departmentid , name , head | affiliated_with : physician , department , primaryaffiliation | procedures : code , name , cost | trained_in : physician , treatment , certificationdate , certificationexpires | patient : ssn , name , address , phone , insuranceid , pcp | nurse : employeeid , name , position , registered , ssn | appointment : appointmentid , patient , prepnurse , physician , start , end , examinationroom | medication : code , name , brand , description | prescribes : physician , patient , medication , date , appointment , dose | block : blockfloor , blockcode | room : roomnumber , roomtype , blockfloor , blockcode , unavailable | on_call : nurse , blockfloor , blockcode , oncallstart , oncallend | stay : stayid , patient , room , staystart , stayend | undergoes : patient , procedures , stay , dateundergoes , physician , assistingnurse	select count(*) from patient where ssn not in ( select t1.patient from prescribes as t1 join medication as t2 on t1.medication = t2.code where t2.name = 'procrastin-x' )
tracking_grants_for_research: list the project details of the projects which did not hire any staff for a researcher role. | document_types : document_type_code , document_description | documents : document_id , document_type_code , grant_id , sent_date , response_received_date , other_details | grants : grant_id , organisation_id , grant_amount , grant_start_date , grant_end_date , other_details | organisation_types : organisation_type , organisation_type_description | organisations : organisation_id , organisation_type , organisation_details | project_outcomes : project_id , outcome_code , outcome_details | project_staff : staff_id , project_id , role_code , date_from , date_to , other_details | projects : project_id , organisation_id , project_details | research_outcomes : outcome_code , outcome_description | research_staff : staff_id , employer_organisation_id , staff_details | staff_roles : role_code , role_description | tasks : task_id , project_id , task_details , eg agree objectives	select project_details from projects where project_id not in ( select project_id from project_staff where role_code = 'researcher' )
tracking_grants_for_research: which projects have no outcome? list the project details. | document_types : document_type_code , document_description | documents : document_id , document_type_code , grant_id , sent_date , response_received_date , other_details | grants : grant_id , organisation_id , grant_amount , grant_start_date , grant_end_date , other_details | organisation_types : organisation_type , organisation_type_description | organisations : organisation_id , organisation_type , organisation_details | project_outcomes : project_id , outcome_code , outcome_details | project_staff : staff_id , project_id , role_code , date_from , date_to , other_details | projects : project_id , organisation_id , project_details | research_outcomes : outcome_code , outcome_description | research_staff : staff_id , employer_organisation_id , staff_details | staff_roles : role_code , role_description | tasks : task_id , project_id , task_details , eg agree objectives	select project_details from projects where project_id not in ( select project_id from project_outcomes )
tracking_grants_for_research: what are the details of the project with no outcomes? | document_types : document_type_code , document_description | documents : document_id , document_type_code , grant_id , sent_date , response_received_date , other_details | grants : grant_id , organisation_id , grant_amount , grant_start_date , grant_end_date , other_details | organisation_types : organisation_type , organisation_type_description | organisations : organisation_id , organisation_type , organisation_details | project_outcomes : project_id , outcome_code , outcome_details | project_staff : staff_id , project_id , role_code , date_from , date_to , other_details | projects : project_id , organisation_id , project_details | research_outcomes : outcome_code , outcome_description | research_staff : staff_id , employer_organisation_id , staff_details | staff_roles : role_code , role_description | tasks : task_id , project_id , task_details , eg agree objectives	select project_details from projects where project_id not in ( select project_id from project_outcomes )
network_2: what is the total number of people who has no friend living in the city of austin. | person : name , age , city , gender , job | personfriend : name , friend , year	select count(distinct name) from personfriend where friend not in (select name from person where city = 'austin')
network_2: what is the total number of people who have no friends living in austin? | person : name , age , city , gender , job | personfriend : name , friend , year	select count(distinct name) from personfriend where friend not in (select name from person where city = 'austin')
college_3: find the first name of students not enrolled in any course. | student : stuid , lname , fname , age , sex , major , advisor , city_code | faculty : facid , lname , fname , rank , sex , phone , room , building | department : dno , division , dname , room , building , dphone | member_of : facid , dno , appt_type | course : cid , cname , credits , instructor , days , hours , dno | minor_in : stuid , dno | enrolled_in : stuid , cid , grade | gradeconversion : lettergrade , gradepoint	select fname from student where stuid not in (select stuid from enrolled_in)
college_3: what are the first names of all students that are not enrolled in courses? | student : stuid , lname , fname , age , sex , major , advisor , city_code | faculty : facid , lname , fname , rank , sex , phone , room , building | department : dno , division , dname , room , building , dphone | member_of : facid , dno , appt_type | course : cid , cname , credits , instructor , days , hours , dno | minor_in : stuid , dno | enrolled_in : stuid , cid , grade | gradeconversion : lettergrade , gradepoint	select fname from student where stuid not in (select stuid from enrolled_in)
soccer_2: what is the total number of enrollment of schools that do not have any goalie player? | college : cname , state , enr | player : pid , pname , ycard , hs | tryout : pid , cname , ppos , decision	"select sum(enr) from college where cname not in (select cname from tryout where ppos = ""goalie"")"
soccer_2: what is the total number of students enrolled in schools without any goalies? | college : cname , state , enr | player : pid , pname , ycard , hs | tryout : pid , cname , ppos , decision	"select sum(enr) from college where cname not in (select cname from tryout where ppos = ""goalie"")"
manufactory_1: find number of products which sony does not make. | manufacturers : code , name , headquarter , founder , revenue | products : code , name , price , manufacturer	select count(distinct name) from products where name not in (select t1.name from products as t1 join manufacturers as t2 on t1.manufacturer = t2.code where t2.name = 'sony')
manufactory_1: how many products are not made by sony? | manufacturers : code , name , headquarter , founder , revenue | products : code , name , price , manufacturer	select count(distinct name) from products where name not in (select t1.name from products as t1 join manufacturers as t2 on t1.manufacturer = t2.code where t2.name = 'sony')
products_gen_characteristics: how many colors are never used by any product? | ref_characteristic_types : characteristic_type_code , characteristic_type_description | ref_colors : color_code , color_description | ref_product_categories : product_category_code , product_category_description , unit_of_measure | characteristics : characteristic_id , characteristic_type_code , characteristic_data_type , characteristic_name , other_characteristic_details | products : product_id , color_code , product_category_code , product_name , typical_buying_price , typical_selling_price , product_description , other_product_details | product_characteristics : product_id , characteristic_id , product_characteristic_value	select count(*) from ref_colors where color_code not in ( select color_code from products )
products_gen_characteristics: count the number of colors that are not used in any products. | ref_characteristic_types : characteristic_type_code , characteristic_type_description | ref_colors : color_code , color_description | ref_product_categories : product_category_code , product_category_description , unit_of_measure | characteristics : characteristic_id , characteristic_type_code , characteristic_data_type , characteristic_name , other_characteristic_details | products : product_id , color_code , product_category_code , product_name , typical_buying_price , typical_selling_price , product_description , other_product_details | product_characteristics : product_id , characteristic_id , product_characteristic_value	select count(*) from ref_colors where color_code not in ( select color_code from products )
dorm_1: find the name of dorms that do not have any amenity | student : stuid , lname , fname , age , sex , major , advisor , city_code | dorm : dormid , dorm_name , student_capacity , gender | dorm_amenity : amenid , amenity_name | has_amenity : dormid , amenid | lives_in : stuid , dormid , room_number	select dorm_name from dorm where dormid not in (select dormid from has_amenity)
dorm_1: what are the names of all the dorms that don't have any amenities? | student : stuid , lname , fname , age , sex , major , advisor , city_code | dorm : dormid , dorm_name , student_capacity , gender | dorm_amenity : amenid , amenity_name | has_amenity : dormid , amenid | lives_in : stuid , dormid , room_number	select dorm_name from dorm where dormid not in (select dormid from has_amenity)
dorm_1: find the first name and age of students who are living in the dorms that do not have amenity tv lounge. | student : stuid , lname , fname , age , sex , major , advisor , city_code | dorm : dormid , dorm_name , student_capacity , gender | dorm_amenity : amenid , amenity_name | has_amenity : dormid , amenid | lives_in : stuid , dormid , room_number	select t1.fname , t1.age from student as t1 join lives_in as t2 on t1.stuid = t2.stuid where t2.dormid not in (select t3.dormid from has_amenity as t3 join dorm_amenity as t4 on t3.amenid = t4.amenid where t4.amenity_name = 'tv lounge')
dorm_1: what is the first name and age of every student who lives in a dorm with a tv lounge? | student : stuid , lname , fname , age , sex , major , advisor , city_code | dorm : dormid , dorm_name , student_capacity , gender | dorm_amenity : amenid , amenity_name | has_amenity : dormid , amenid | lives_in : stuid , dormid , room_number	select t1.fname , t1.age from student as t1 join lives_in as t2 on t1.stuid = t2.stuid where t2.dormid not in (select t3.dormid from has_amenity as t3 join dorm_amenity as t4 on t3.amenid = t4.amenid where t4.amenity_name = 'tv lounge')
